{
  "doc_id": "08f6d7d0-6347-4d74-b7d8-d723b2a9b1ff",
  "source_type": "other",
  "title": "Схема 8",
  "authors": [],
  "date": null,
  "language": "ru",
  "full_text": "a Howse pat пав [2 [во AN Фа к ‘Koearamnae rotamer =20+10-10 sant =e ‘Nomporar фота Оз cusses Soom?",
  "sections": [
    {
      "heading": "",
      "text": "a Howse pat пав [2 [во AN Фа к ‘Koearamnae rotamer =20+10-10 sant =e ‘Nomporar фота Оз cusses Soom?",
      "page_range": [
        1,
        1
      ]
    }
  ],
  "tables": [],
  "metadata": {
    "file_name": "Схема 8.png",
    "file_type": "png",
    "ocr_confidence": 0.2416,
    "extra": {
      "ocr_engine": "tesseract"
    }
  }
}