{
  "doc_id": "b9c5ec91-0f13-430b-8e0c-f4e0127eca71",
  "source_type": "other",
  "title": "Типичный список оборудования 1",
  "authors": [],
  "date": null,
  "language": "ru",
  "full_text": "Поз Наименование бабе | Примем 1. Дробильный цех 12. Корпус дробления талнахских руд \"Приемный бункер № 6 i om. \"Приемный бункер № 201A 1 cm `Пластинчатый питатель № 6 1 cm Kouneliep ленточный № 6 пр. 1 om. Конвейер ленточный 1 cm Конвейер ленточный 1 cm ` Дробилка конусная КРД 700/75 № 4 1 om. Sibra 2DR 25х60 № 1 | Грохот Sibra 2DR 2560 № 1 1 cm 1.2-Sibra DR 25x60 №2 | Грохот Sibra 2DR 25%60 №2 1 cm Дробилка конусная КМД-22007 Ne 1 1 om. Дробилка конусная KMJI-2200T №2 1 cm Конвейер ленточный № 202 1 om. Конвейер ленточный № 203, т сущ. Конвейер ленточный № 205 1 сущ. Конвейер ленточный 1 cm Конвейер ленточный 1 om. `Измельчительно-флотационный пех Лк 43a, Tx © IIx. 45a; ILx. 4-5: x Иа Tx 411; Ленточный конвейер и comm Лк 5-1а: Лк. 5-1; Лк. 5-2; Лк 5-48; Лк. 5-4 43 `Мельнииа МШРГУ 4.5:6.0 i om Классификатор спиральный 4-3 43-CF 1KCI24M 1 вы 45,411 `Мельница МШР 3,-3.8 2 om Классификатор спиральный 45.11 4-5.11-СЕ и тор спирали 1 сущ. 51:52 `Мельница МШРГУ 4.5:6.0 2 om Классификатор спиральный 5-12 5-12-СЕ OK И тор спирали 1 сущ. 54 `Мельнииа МШРГУ 4,5-6,0 i om, Классификатор спиральный 5-4 5-4-CF Kas 1 сущ. 42 `Мельнииа MIMI 4.560 т om 42-11-60 Гидропиклон 660 - 1 батарея ИЯ сущ. 53 `Мельница МШЦ 4.56.0 1 сущ. 5311660 Гидропиклон 660 - 1 батарея ИЯ сущ. 55 `Мельнииа МШИ 4.5>6.0 1 cm. 5-57Ц:560 Гидропиклон 660 - 1 батарея ii om. 4-СТ-01..06 \"Сгуститель раднальный П-30 № 1.6 6 сущ. 4-СТ-07 `Сгуститель ралнальный П-50 №7 1 cm. 2-1..2-16.2-19. `Флотомашина ФПМ-16-4К is om.",
  "sections": [
    {
      "heading": "",
      "text": "Поз Наименование бабе | Примем 1. Дробильный цех 12. Корпус дробления талнахских руд \"Приемный бункер № 6 i om. \"Приемный бункер № 201A 1 cm `Пластинчатый питатель № 6 1 cm Kouneliep ленточный № 6 пр. 1 om. Конвейер ленточный 1 cm Конвейер ленточный 1 cm ` Дробилка конусная КРД 700/75 № 4 1 om. Sibra 2DR 25х60 № 1 | Грохот Sibra 2DR 2560 № 1 1 cm 1.2-Sibra DR 25x60 №2 | Грохот Sibra 2DR 25%60 №2 1 cm Дробилка конусная КМД-22007 Ne 1 1 om. Дробилка конусная KMJI-2200T №2 1 cm Конвейер ленточный № 202 1 om. Конвейер ленточный № 203, т сущ. Конвейер ленточный № 205 1 сущ. Конвейер ленточный 1 cm Конвейер ленточный 1 om. `Измельчительно-флотационный пех Лк 43a, Tx © IIx. 45a; ILx. 4-5: x Иа Tx 411; Ленточный конвейер и comm Лк 5-1а: Лк. 5-1; Лк. 5-2; Лк 5-48; Лк. 5-4 43 `Мельнииа МШРГУ 4.5:6.0 i om Классификатор спиральный 4-3 43-CF 1KCI24M 1 вы 45,411 `Мельница МШР 3,-3.8 2 om Классификатор спиральный 45.11 4-5.11-СЕ и тор спирали 1 сущ. 51:52 `Мельница МШРГУ 4.5:6.0 2 om Классификатор спиральный 5-12 5-12-СЕ OK И тор спирали 1 сущ. 54 `Мельнииа МШРГУ 4,5-6,0 i om, Классификатор спиральный 5-4 5-4-CF Kas 1 сущ. 42 `Мельнииа MIMI 4.560 т om 42-11-60 Гидропиклон 660 - 1 батарея ИЯ сущ. 53 `Мельница МШЦ 4.56.0 1 сущ. 5311660 Гидропиклон 660 - 1 батарея ИЯ сущ. 55 `Мельнииа МШИ 4.5>6.0 1 cm. 5-57Ц:560 Гидропиклон 660 - 1 батарея ii om. 4-СТ-01..06 \"Сгуститель раднальный П-30 № 1.6 6 сущ. 4-СТ-07 `Сгуститель ралнальный П-50 №7 1 cm. 2-1..2-16.2-19. `Флотомашина ФПМ-16-4К is om.",
      "page_range": [
        1,
        1
      ]
    }
  ],
  "tables": [],
  "metadata": {
    "file_name": "Типичный список оборудования 1.png",
    "file_type": "png",
    "ocr_confidence": 0.662,
    "extra": {
      "ocr_engine": "tesseract"
    }
  }
}