{
  "doc_id": "16509908-2c20-48c8-87f2-62a65a45dbc0",
  "source_type": "other",
  "title": "Схема 5",
  "authors": [],
  "date": null,
  "language": "ru",
  "full_text": "(2-660 luxme weduemee анна ра Snep- 4-1 uxma weducne ра анк Syonep-5-2 кии luxe мевоктых _ 4-P6-03, м2 09-9201 Woot? We Negpewemiad пробуя 2 Apobunnaae цеха 12. L Meducmue u Веропленные рубы. Koynwocme -260 м weed",
  "sections": [
    {
      "heading": "",
      "text": "(2-660 luxme weduemee анна ра Snep- 4-1 uxma weducne ра анк Syonep-5-2 кии luxe мевоктых _ 4-P6-03, м2 09-9201 Woot? We Negpewemiad пробуя 2 Apobunnaae цеха 12. L Meducmue u Веропленные рубы. Koynwocme -260 м weed",
      "page_range": [
        1,
        1
      ]
    }
  ],
  "tables": [],
  "metadata": {
    "file_name": "Схема 5.png",
    "file_type": "png",
    "ocr_confidence": 0.3194,
    "extra": {
      "ocr_engine": "tesseract"
    }
  }
}