{
  "doc_id": "fbab8190-62d9-4469-a62f-cb50255d050c",
  "source_type": "other",
  "title": "Типичный список оборудования 2",
  "authors": [],
  "date": null,
  "language": "ru",
  "full_text": "Кол. Поз Нанменование (pas ipen) | DDE и и р Флотомашина ФПМ-16-4К и сущ. 44 46,417, £18 `Флотомашина @M-16VMAK a om 4-PG-02.01; 4-PG-02.02 [Агрегат электронасосный cym Hacoc W4-16, W4-17 2 Зумпф т 4-26-03 `Агрегат электронасосный om Насос W4-2, W4-3 ИЯ Зумпф 1 4-Р6-04.01:4-Р6-04.07 | Anperar электронасосвый om Hacoc W4-49, W4-50 2 Зумпф 1 4-26-05 `Агрегат электронасосный om Насос W4-45, W4-46 ПИ Зумпф 1 4-26-06 `Агрегат электронасосный om Hacoc W4-49, W4-50 ПИ Зумпф 1 4-26-07 `Агрегат электронасосный om Hacoc W4-41, W4-42 ПИ Зумпф 1 4-26-08 `Агрегат электронасосный сут \"Насос W4-33, 74-34 И Зумпф 1 4-26-09 `Агрегат электронасосный om Hacoc W4-29, W4-30 ПИ Зумпф 1 4-26-10 `Агрегат электронасосный сут \"Насос W4-47, 74-48 И Зумпф 1 4G-01.1..061 `Агрегат электронасосный сут Насос 66 Зумпф 6 426-071 `Агрегат электронасосный сут Насос W7-1, 7-2 ИЯ Зумпф 1 2-PG-06.01; 2-PG-06.02_| Агрегат электронасосвый ym Hacoc W2-43, W2-44 2 Зумпф 1 2-26-07 `Агрегат электронасосный сут Насос W2-39, W2-40 И Зумпф 1 2-PG-08, 09 ‘Arperar электронасосный ym Насос W2-33, W2-34; W2-35, №7236 | 22 Зумпф 2 2-26-10. 11 `Агрегат электронасосный сут Насос W2-61, W2-62; W2-63, 72-64 [202 Зумпф 2",
  "sections": [
    {
      "heading": "",
      "text": "Кол. Поз Нанменование (pas ipen) | DDE и и р Флотомашина ФПМ-16-4К и сущ. 44 46,417, £18 `Флотомашина @M-16VMAK a om 4-PG-02.01; 4-PG-02.02 [Агрегат электронасосный cym Hacoc W4-16, W4-17 2 Зумпф т 4-26-03 `Агрегат электронасосный om Насос W4-2, W4-3 ИЯ Зумпф 1 4-Р6-04.01:4-Р6-04.07 | Anperar электронасосвый om Hacoc W4-49, W4-50 2 Зумпф 1 4-26-05 `Агрегат электронасосный om Насос W4-45, W4-46 ПИ Зумпф 1 4-26-06 `Агрегат электронасосный om Hacoc W4-49, W4-50 ПИ Зумпф 1 4-26-07 `Агрегат электронасосный om Hacoc W4-41, W4-42 ПИ Зумпф 1 4-26-08 `Агрегат электронасосный сут \"Насос W4-33, 74-34 И Зумпф 1 4-26-09 `Агрегат электронасосный om Hacoc W4-29, W4-30 ПИ Зумпф 1 4-26-10 `Агрегат электронасосный сут \"Насос W4-47, 74-48 И Зумпф 1 4G-01.1..061 `Агрегат электронасосный сут Насос 66 Зумпф 6 426-071 `Агрегат электронасосный сут Насос W7-1, 7-2 ИЯ Зумпф 1 2-PG-06.01; 2-PG-06.02_| Агрегат электронасосвый ym Hacoc W2-43, W2-44 2 Зумпф 1 2-26-07 `Агрегат электронасосный сут Насос W2-39, W2-40 И Зумпф 1 2-PG-08, 09 ‘Arperar электронасосный ym Насос W2-33, W2-34; W2-35, №7236 | 22 Зумпф 2 2-26-10. 11 `Агрегат электронасосный сут Насос W2-61, W2-62; W2-63, 72-64 [202 Зумпф 2",
      "page_range": [
        1,
        1
      ]
    }
  ],
  "tables": [],
  "metadata": {
    "file_name": "Типичный список оборудования 2.png",
    "file_type": "png",
    "ocr_confidence": 0.6783,
    "extra": {
      "ocr_engine": "tesseract"
    }
  }
}