{
  "doc_id": "11111111-1111-4111-8111-111111111111",
  "source_type": "report",
  "title": "Отчёт по вещественному составу хвостов обогатительной фабрики КГМК",
  "authors": ["Институт обогащения полезных ископаемых"],
  "date": "2022-03-15",
  "language": "ru",
  "full_text": "Хвосты флотации содержат остаточное золото в тонковкрапленной форме, ассоциированное с сульфидами железа. Основной причиной потерь является недостаточное раскрытие сростков при текущей крупности помола. Повышение степени измельчения до класса -74 мкм позволяет увеличить раскрытие сульфидных минералов на 12-18%.",
  "sections": [
    {
      "heading": "Вещественный состав хвостов",
      "text": "Хвосты флотации содержат остаточное золото в тонковкрапленной форме, ассоциированное с сульфидами железа (пирит, арсенопирит). Основной причиной потерь является недостаточное раскрытие сростков при текущей крупности помола.",
      "page_range": [1, 3]
    },
    {
      "heading": "Рекомендации по доизмельчению",
      "text": "Повышение степени измельчения до класса -74 мкм позволяет увеличить раскрытие сульфидных минералов на 12-18%, что напрямую влияет на извлечение золота при последующей флотации или цианировании.",
      "page_range": [4, 5]
    }
  ],
  "tables": [
    {
      "caption": "Гранулометрический состав хвостов по классам крупности",
      "data": [
        ["Класс крупности, мкм", "Выход, %", "Содержание Au, г/т"],
        ["+150", "8.2", "0.9"],
        ["-150+74", "24.5", "1.4"],
        ["-74", "67.3", "2.1"]
      ],
      "page": 3
    }
  ],
  "metadata": {
    "file_name": "Хвосты КГМК.xlsx",
    "file_type": "xlsx",
    "ocr_confidence": null,
    "extra": { "sheet_count": 4 }
  }
}
