{
  "doc_id": "e67db086-67c0-45b3-bc6a-bcdb79109bdc",
  "source_type": "other",
  "title": "Гипотезы НОФ мед",
  "authors": [],
  "date": null,
  "language": "ru",
  "full_text": "Гипотезы по результатам мозгового штурма:",
  "sections": [
    {
      "heading": "",
      "text": "Гипотезы по результатам мозгового штурма:",
      "page_range": [
        1,
        1
      ]
    }
  ],
  "tables": [
    {
      "caption": "",
      "data": [
        [
          "1. Контроль гранулометрии руды питающей 6м мельницы"
        ],
        [
          "2. Повышение целевой плотности пульпы на входе в основную флотацию"
        ],
        [
          "3. Добавление промежуточных контактных чанов для увеличения времени агитации перед операцией контрольной флотации"
        ],
        [
          "4. Добавление промежуточной дробилки рудной гали для снижения возвратной нагрузки перед 6м мельницами"
        ],
        [
          "5. Замена песковых насадок на гидроциклонах с уменьшением диаметра с 12 на 8"
        ],
        [
          "6. Добавление реагента Finfix 300 в контактные чаны перед основной флотацией"
        ],
        [
          "7. Переход на 100% загрузку мелящих шаров диаметром 120мм"
        ],
        [
          "8. На 6м мельницах опробовать переход на мелящие шары 5-го класса повышенной износостойкости"
        ]
      ],
      "page": null
    }
  ],
  "metadata": {
    "file_name": "Гипотезы НОФ мед.docx",
    "file_type": "docx",
    "ocr_confidence": null,
    "extra": {}
  }
}