{
  "doc_id": "9b9ace97-c5fd-4cf2-a062-c9a4c5090b41",
  "source_type": "other",
  "title": "Схема флотации 4",
  "authors": [],
  "date": null,
  "language": "ru",
  "full_text": "Шаровая мельница Скоростная Концентратор Нельсона флотация =30с 1 5 Концентрат скоростной флотации Скоростная I флотация |Скоростная Скоростная флотация 1=30с Гравитационный концентрат 8 Основная Хвосты 1 флотация 2 Хвосты ольыия 10 мин 3 Доизмельчение 2 лота н Агитация 5 t=25 мин 5 Хвосты Флот: ационный концентрат",
  "sections": [
    {
      "heading": "",
      "text": "Шаровая мельница Скоростная Концентратор Нельсона флотация =30с 1 5 Концентрат скоростной флотации Скоростная I флотация |Скоростная Скоростная флотация 1=30с Гравитационный концентрат 8 Основная Хвосты 1 флотация 2 Хвосты ольыия 10 мин 3 Доизмельчение 2 лота н Агитация 5 t=25 мин 5 Хвосты Флот: ационный концентрат",
      "page_range": [
        1,
        1
      ]
    }
  ],
  "tables": [],
  "metadata": {
    "file_name": "Схема флотации 4.png",
    "file_type": "png",
    "ocr_confidence": 0.8049,
    "extra": {
      "ocr_engine": "tesseract"
    }
  }
}