{
  "doc_id": "4916afa7-6b77-4c72-9e77-ebeb90b2f3c1",
  "source_type": "other",
  "title": "Гипотезы ТОФ",
  "authors": [],
  "date": null,
  "language": "ru",
  "full_text": "Гипотезы по результатам мозгового штурма:",
  "sections": [
    {
      "heading": "",
      "text": "Гипотезы по результатам мозгового штурма:",
      "page_range": [
        1,
        1
      ]
    }
  ],
  "tables": [
    {
      "caption": "",
      "data": [
        [
          "1. Донастройка скорости вращения классификаторов"
        ],
        [
          "2. Изменение геометрии футеровки мельниц"
        ],
        [
          "3. Дополнительная классификация целевого класса"
        ],
        [
          "4. Замена классификаторов на более производительные"
        ],
        [
          "5. Грохота тонкого грохочения после 2 стадии классификации"
        ],
        [
          "6. Опробование эффективности гидроциклонов"
        ],
        [
          "7. Классификация хвостов и возврат в голову процесса"
        ],
        [
          "8. Контрольная классификация"
        ]
      ],
      "page": null
    }
  ],
  "metadata": {
    "file_name": "Гипотезы ТОФ.docx",
    "file_type": "docx",
    "ocr_confidence": null,
    "extra": {}
  }
}