{
  "doc_id": "55a59f51-1718-4f51-b114-09717b954280",
  "source_type": "other",
  "title": "Гипотезы КГМК",
  "authors": [],
  "date": null,
  "language": "ru",
  "full_text": "Гипотезы по результатам мозгового штурма:",
  "sections": [
    {
      "heading": "",
      "text": "Гипотезы по результатам мозгового штурма:",
      "page_range": [
        1,
        1
      ]
    }
  ],
  "tables": [
    {
      "caption": "",
      "data": [
        [
          "1. Магнитная сепарация над целевого класса с последующим доизмельчением в отдельном цикле"
        ],
        [
          "2. Изменение геометрии футеровки шаровых мельниц"
        ],
        [
          "3. Замена песковых насадок на гидроциклонах с уменьшением диаметра с 12 на 8"
        ],
        [
          "4. Полная замена классификаторов на гидроциклоны"
        ],
        [
          "5. Грохота тонкого грохочения после 2 стадии измельчения как альтернатива магнитной сепарации"
        ]
      ],
      "page": null
    }
  ],
  "metadata": {
    "file_name": "Гипотезы КГМК.docx",
    "file_type": "docx",
    "ocr_confidence": null,
    "extra": {}
  }
}