{
  "doc_id": "22222222-2222-4222-8222-222222222222",
  "source_type": "article",
  "title": "Технология извлечения золота и серебра из упорного золотосодержащего сырья",
  "authors": ["Лодейщиков В.В."],
  "date": "2018-06-01",
  "language": "ru",
  "full_text": "Упорность золотосодержащих руд и хвостов часто вызвана инкапсуляцией золота в сульфидной матрице. Предварительное окисление сульфидов (бактериальное, автоклавное или через обжиг) раскрывает тонковкрапленное золото и повышает извлечение при цианировании до 85-92%. Применение интенсивного цианирования с добавлением кислорода и повышенной концентрацией NaCN сокращает время выщелачивания на 20-30%.",
  "sections": [
    {
      "heading": "Причины упорности",
      "text": "Упорность золотосодержащих руд и хвостов часто вызвана инкапсуляцией золота в сульфидной матрице (пирит, арсенопирит), а также присутствием углистого вещества, сорбирующего растворённое золото (preg-robbing).",
      "page_range": [12, 14]
    },
    {
      "heading": "Методы предварительного окисления",
      "text": "Предварительное окисление сульфидов (бактериальное выщелачивание, автоклавное окисление под давлением или окислительный обжиг) раскрывает тонковкрапленное золото и повышает извлечение при последующем цианировании до 85-92%.",
      "page_range": [15, 20]
    },
    {
      "heading": "Интенсивное цианирование",
      "text": "Применение интенсивного цианирования с барботажем кислорода и повышенной концентрацией NaCN (до 2-3 г/л) сокращает время выщелачивания на 20-30% по сравнению со стандартным режимом.",
      "page_range": [21, 23]
    }
  ],
  "tables": [],
  "metadata": {
    "file_name": "tehnologiya_izvlecheniya_zolota_i_serebra_iz_upornogo_zolotosoderzhaschego.pdf",
    "file_type": "pdf",
    "ocr_confidence": null,
    "extra": { "pages_total": 210 }
  }
}
