{
  "doc_id": "5bdc9396-756d-40ac-84e2-c2df837aaab9",
  "source_type": "other",
  "title": "Схема 1",
  "authors": [],
  "date": null,
  "language": "ru",
  "full_text": "карьер. шахта (750 +0 мм) (300 +0 nm) 25 [обо one 078 [02 ara [roo oto] а ОЕ Грохочение опосниковый грохот 150 +0 мм. F150 non Oras = 550 0 npwunpne DpoGnenne 1 ст. разпруочной ‘Ulan 120 wr) = 16040 = “250 +0 ми anne = 890081 pw usp ` Дробление 2 ст. ` Дробление 2 ст. asrpyonneh KC 2200 Fp шт) KC 2200 Tp шт) щели 0 мы 85160) 20m 30500 им 6.2 и чвзаза] 4] aro] aaa ae [aor] = ео = 1499 880 м’/еод Грохочение `Двужситный грохот Sibra 208 (4 шт) Tat meet) перев hes ‘Sonata Дробление 3c у same Е Lranonpovone Hou ore arn Soe TER ® ЕЕ у B бункеры HOU, [5581364064 035 [035 1% @,mieod | Ве, | Bu, % veme | Vim'/e0d | Bas, % | Boor %",
  "sections": [
    {
      "heading": "",
      "text": "карьер. шахта (750 +0 мм) (300 +0 nm) 25 [обо one 078 [02 ara [roo oto] а ОЕ Грохочение опосниковый грохот 150 +0 мм. F150 non Oras = 550 0 npwunpne DpoGnenne 1 ст. разпруочной ‘Ulan 120 wr) = 16040 = “250 +0 ми anne = 890081 pw usp ` Дробление 2 ст. ` Дробление 2 ст. asrpyonneh KC 2200 Fp шт) KC 2200 Tp шт) щели 0 мы 85160) 20m 30500 им 6.2 и чвзаза] 4] aro] aaa ae [aor] = ео = 1499 880 м’/еод Грохочение `Двужситный грохот Sibra 208 (4 шт) Tat meet) перев hes ‘Sonata Дробление 3c у same Е Lranonpovone Hou ore arn Soe TER ® ЕЕ у B бункеры HOU, [5581364064 035 [035 1% @,mieod | Ве, | Bu, % veme | Vim'/e0d | Bas, % | Boor %",
      "page_range": [
        1,
        1
      ]
    }
  ],
  "tables": [],
  "metadata": {
    "file_name": "Схема 1.png",
    "file_type": "png",
    "ocr_confidence": 0.4563,
    "extra": {
      "ocr_engine": "tesseract"
    }
  }
}