{
  "doc_id": "8efebf52-96a4-4a15-9ce7-68913b5291c8",
  "source_type": "other",
  "title": "Схема 4",
  "authors": [],
  "date": null,
  "language": "ru",
  "full_text": "© ©. Tia [тов [14046 888 [370060 [133 [07] подо 209 ово] 35 [055 25.4 [2 104500] 2225 - `Удельныйнасыпной вес руды (шихты) 7 2 ‘Aposnenve 1 cr. при ширине _ р. \"Октябрьский\" gar |196 mi? serena un) разрузочной р. 'Комомользий\" — 304 |201 пм щели = 75 мм Шоса руд pacvern) 307 |20 пы? $ 100 +0 мм ода 209 000] 135 [ 055 25.4 [2 104500] 38.50[_- Е 1593351 м?дод га Грохочение Двужситный грохот Sibra 208 (2 шт) FRC EES maar] = > aio] 78258 [135 [055 95,9 [1497 141165 39 [519215 [5815] 99 [1659 265 [10.0367 „Ото = 360 1h ‘одной дробилки, Дробление 3 cr. У при ширине, КМД 2200 7 2 шт) Шламопроводв HOU, росой щели = 12 м -30 0 Tia ane mes] © 05.0 [1497 141] 050 B бункеры ИФЦ ase] 032714] 438 | 085 хх [а тео] Be % | Вы %me. [У w°/e00| Bas, % Роли: %",
  "sections": [
    {
      "heading": "",
      "text": "© ©. Tia [тов [14046 888 [370060 [133 [07] подо 209 ово] 35 [055 25.4 [2 104500] 2225 - `Удельныйнасыпной вес руды (шихты) 7 2 ‘Aposnenve 1 cr. при ширине _ р. \"Октябрьский\" gar |196 mi? serena un) разрузочной р. 'Комомользий\" — 304 |201 пм щели = 75 мм Шоса руд pacvern) 307 |20 пы? $ 100 +0 мм ода 209 000] 135 [ 055 25.4 [2 104500] 38.50[_- Е 1593351 м?дод га Грохочение Двужситный грохот Sibra 208 (2 шт) FRC EES maar] = > aio] 78258 [135 [055 95,9 [1497 141165 39 [519215 [5815] 99 [1659 265 [10.0367 „Ото = 360 1h ‘одной дробилки, Дробление 3 cr. У при ширине, КМД 2200 7 2 шт) Шламопроводв HOU, росой щели = 12 м -30 0 Tia ane mes] © 05.0 [1497 141] 050 B бункеры ИФЦ ase] 032714] 438 | 085 хх [а тео] Be % | Вы %me. [У w°/e00| Bas, % Роли: %",
      "page_range": [
        1,
        1
      ]
    }
  ],
  "tables": [],
  "metadata": {
    "file_name": "Схема 4.png",
    "file_type": "png",
    "ocr_confidence": 0.527,
    "extra": {
      "ocr_engine": "tesseract"
    }
  }
}