{
  "doc_id": "fbc67015-39ce-4d43-803d-86239f57d14a",
  "source_type": "other",
  "title": "Схема флотации 2",
  "authors": [],
  "date": null,
  "language": "ru",
  "full_text": "Исходное питание Основной поток Измельчение в инертной среде Измельчение [ст. Флотация Хвосты Утратонкое измельчение Флотация Флотация Хвосты Параллельная ветвь Концентрат Концентрат Концентрат с высоким со средним с НИЗКИМ содержанием содержанием содержанием Металлургический передел etna",
  "sections": [
    {
      "heading": "",
      "text": "Исходное питание Основной поток Измельчение в инертной среде Измельчение [ст. Флотация Хвосты Утратонкое измельчение Флотация Флотация Хвосты Параллельная ветвь Концентрат Концентрат Концентрат с высоким со средним с НИЗКИМ содержанием содержанием содержанием Металлургический передел etna",
      "page_range": [
        1,
        1
      ]
    }
  ],
  "tables": [],
  "metadata": {
    "file_name": "Схема флотации 2.png",
    "file_type": "png",
    "ocr_confidence": 0.9079,
    "extra": {
      "ocr_engine": "tesseract"
    }
  }
}