{
  "doc_id": "41a4aec3-d430-435c-b961-8b8e44412b05",
  "source_type": "other",
  "title": "Схема флотации",
  "authors": [],
  "date": null,
  "language": "ru",
  "full_text": "`Бутиловый ксан- ‚р тогенат 40-50 rhe ‘Сернистый мат. A pit — 200-250 r/r вание масло. Э-1-25 0h la 88-92 % класса 0,074 мм утилоный исаитогснат 25-351 пиковый купоров — 80-160 тит Tona кальцинирован- ная — 200 г/т; 6) ксаитотенат 0, 66 — 3-4 тн тины сии war Och",
  "sections": [
    {
      "heading": "",
      "text": "`Бутиловый ксан- ‚р тогенат 40-50 rhe ‘Сернистый мат. A pit — 200-250 r/r вание масло. Э-1-25 0h la 88-92 % класса 0,074 мм утилоный исаитогснат 25-351 пиковый купоров — 80-160 тит Tona кальцинирован- ная — 200 г/т; 6) ксаитотенат 0, 66 — 3-4 тн тины сии war Och",
      "page_range": [
        1,
        1
      ]
    }
  ],
  "tables": [],
  "metadata": {
    "file_name": "Схема флотации.png",
    "file_type": "png",
    "ocr_confidence": 0.511,
    "extra": {
      "ocr_engine": "tesseract"
    }
  }
}