{
  "doc_id": "03e890a4-2369-4423-b4c2-e6dddd6408ba",
  "source_type": "other",
  "title": "Схема 6",
  "authors": [],
  "date": null,
  "language": "ru",
  "full_text": "Узел откачки Cu к-та е-иа | | основная | основная 4-26-01 OO саша. W соотв. 4-CT-01.06 Witz Азрация Перечиспная Weta | Cu флотация Cu флотация nomauus I | Е ЕЕ 511515 | |[5 588 5 НЗ НаН| Нанна #2 ПЕН|ен|еН|а 3 3 = + + 4 + + = + s 3 + + 4.04.08 4-33.36 Чзел откачки Cu K-ma 4 were 4.9.09 м2 6955555} 41-08 au",
  "sections": [
    {
      "heading": "",
      "text": "Узел откачки Cu к-та е-иа | | основная | основная 4-26-01 OO саша. W соотв. 4-CT-01.06 Witz Азрация Перечиспная Weta | Cu флотация Cu флотация nomauus I | Е ЕЕ 511515 | |[5 588 5 НЗ НаН| Нанна #2 ПЕН|ен|еН|а 3 3 = + + 4 + + = + s 3 + + 4.04.08 4-33.36 Чзел откачки Cu K-ma 4 were 4.9.09 м2 6955555} 41-08 au",
      "page_range": [
        1,
        1
      ]
    }
  ],
  "tables": [],
  "metadata": {
    "file_name": "Схема 6.png",
    "file_type": "png",
    "ocr_confidence": 0.5378,
    "extra": {
      "ocr_engine": "tesseract"
    }
  }
}