{
  "doc_id": "893dc78e-062a-457d-87aa-ac2eb50e3872",
  "source_type": "other",
  "title": "Схема 3",
  "authors": [],
  "date": null,
  "language": "ru",
  "full_text": "Пирние флотащии 2% [am | Ва. Г Вы. (60.5% -0045 ыы) . Bonae en tee [SEE Кони 2 основная Си-флотация [Вспениваталь 152 | Sirir Ta aus аря (О вывезет ПРЕ [@) sem (6) ВЕР aia | 257 [172 [203 © “ © asi] 03a 9 0.43 | 0.60) Г Eto sen opm 351 [255 [172 [205 \"Слив пез” 634 [943 [080] | Ss I ape =. = | = ees ee mis Stee ae t-01 30-35} += 1-Си Перечистная фпотация_ Arava ase “402 [248 [848 OT ® ® 425 | 26.4 [10.30] 290, у fT nent a eee Tike Peart pom a i Canam ебет ‘отпальные хвосты “3768 wh Нинель пирротиновый концентрат",
  "sections": [
    {
      "heading": "",
      "text": "Пирние флотащии 2% [am | Ва. Г Вы. (60.5% -0045 ыы) . Bonae en tee [SEE Кони 2 основная Си-флотация [Вспениваталь 152 | Sirir Ta aus аря (О вывезет ПРЕ [@) sem (6) ВЕР aia | 257 [172 [203 © “ © asi] 03a 9 0.43 | 0.60) Г Eto sen opm 351 [255 [172 [205 \"Слив пез” 634 [943 [080] | Ss I ape =. = | = ees ee mis Stee ae t-01 30-35} += 1-Си Перечистная фпотация_ Arava ase “402 [248 [848 OT ® ® 425 | 26.4 [10.30] 290, у fT nent a eee Tike Peart pom a i Canam ебет ‘отпальные хвосты “3768 wh Нинель пирротиновый концентрат",
      "page_range": [
        1,
        1
      ]
    }
  ],
  "tables": [],
  "metadata": {
    "file_name": "Схема 3.png",
    "file_type": "png",
    "ocr_confidence": 0.41,
    "extra": {
      "ocr_engine": "tesseract"
    }
  }
}