{
  "doc_id": "c03c7dc9-c050-4c83-b108-65467b5872de",
  "source_type": "other",
  "title": "Гипотезы НОФ вкр",
  "authors": [],
  "date": null,
  "language": "ru",
  "full_text": "Гипотезы по результатам мозгового штурма:",
  "sections": [
    {
      "heading": "",
      "text": "Гипотезы по результатам мозгового штурма:",
      "page_range": [
        1,
        1
      ]
    }
  ],
  "tables": [
    {
      "caption": "",
      "data": [
        [
          "1. Изменение геометрии футеровки мельниц 3,3м и 6м."
        ],
        [
          "2. Контроль гранулометрии руды после конусных дробилок"
        ],
        [
          "3. Автоматическое регулирование зазора щели конусных дробилок"
        ],
        [
          "4. Автоматизация подачи воды в шаровые мельницы второго этапа измельчения"
        ],
        [
          "5. Замена насадок на классификторах для лучшего контроля возвратной нагрузки"
        ],
        [
          "6. Перераспределение фронта флотации для увеличения времени первой контрольной операции"
        ]
      ],
      "page": null
    }
  ],
  "metadata": {
    "file_name": "Гипотезы НОФ вкр.docx",
    "file_type": "docx",
    "ocr_confidence": null,
    "extra": {}
  }
}