{
  "doc_id": "186eec94-0a57-4dab-85be-8e8853162f2b",
  "source_type": "other",
  "title": "Схема 7",
  "authors": [],
  "date": null,
  "language": "ru",
  "full_text": "До 65 % кл 45 мкм O Crymenne ‘NavS-700r'7 pH=11,5 See | `Агитайия 1 10 мин Уголь О о ы Агитация? 15 мин Kx-30+30+25 rit A£20+15+10 тт Коллективная флотация t=20+10+10 мин РОН ¥ Классификация ТАФ7 - 101 1 CuNi флот. 30 мин, СБИ 470 гя-до pH=10.2 To 93 >} 2 Азрания 10 мин |+ ТАФ7-5тт №5 10 г7т- до pH=10.3 IL Cu-Ni флот. 35 мин СБИ 185 r/t-a0 рн 92 ЗА: 10 мин ТАФ7-5 rit Сосновое масло - 051] 0.1 №510 рт Bi dcorcac pies = Си флот. 30 мин СБИ 460 гя-до р Т Са переч. 25 мин и ИА `Азрация 10 мин TA®7 TOCHOEOE асно ~ 0.5 r/t П Си перез. 20 мин (Cu к-т на сгущение © 93 96 кл.- 45 мкм Контрольная пер.10 мин — Контрольная флотация 10 мин Ро ктна сгушение >| Общие отвальные хвосты на сгущение",
  "sections": [
    {
      "heading": "",
      "text": "До 65 % кл 45 мкм O Crymenne ‘NavS-700r'7 pH=11,5 See | `Агитайия 1 10 мин Уголь О о ы Агитация? 15 мин Kx-30+30+25 rit A£20+15+10 тт Коллективная флотация t=20+10+10 мин РОН ¥ Классификация ТАФ7 - 101 1 CuNi флот. 30 мин, СБИ 470 гя-до pH=10.2 To 93 >} 2 Азрания 10 мин |+ ТАФ7-5тт №5 10 г7т- до pH=10.3 IL Cu-Ni флот. 35 мин СБИ 185 r/t-a0 рн 92 ЗА: 10 мин ТАФ7-5 rit Сосновое масло - 051] 0.1 №510 рт Bi dcorcac pies = Си флот. 30 мин СБИ 460 гя-до р Т Са переч. 25 мин и ИА `Азрация 10 мин TA®7 TOCHOEOE асно ~ 0.5 r/t П Си перез. 20 мин (Cu к-т на сгущение © 93 96 кл.- 45 мкм Контрольная пер.10 мин — Контрольная флотация 10 мин Ро ктна сгушение >| Общие отвальные хвосты на сгущение",
      "page_range": [
        1,
        1
      ]
    }
  ],
  "tables": [],
  "metadata": {
    "file_name": "Схема 7.png",
    "file_type": "png",
    "ocr_confidence": 0.5711,
    "extra": {
      "ocr_engine": "tesseract"
    }
  }
}