{
  "doc_id": "33333333-3333-4333-8333-333333333333",
  "source_type": "patent",
  "title": "Способ доводки хвостов флотации с применением комбинированного собирателя",
  "authors": [],
  "date": "2020-11-02",
  "language": "ru",
  "full_text": "Изобретение относится к обогащению полезных ископаемых и может быть использовано при доводке лежалых хвостов флотации. Технический результат достигается применением комбинации ксантогената и аэрофлота при подщелачивании пульпы известью до pH 10.5-11.0, что повышает извлечение сульфидных минералов из хвостов на 8-15% без существенного роста расхода реагентов.",
  "sections": [
    {
      "heading": "Формула изобретения",
      "text": "Способ переработки лежалых хвостов флотации, включающий измельчение, кондиционирование пульпы с известью до pH 10.5-11.0 и флотацию с комбинированным собирателем на основе бутилового ксантогената и аэрофлота при их соотношении 3:1.",
      "page_range": [1, 1]
    },
    {
      "heading": "Пример осуществления",
      "text": "При переработке хвостов текущей флотации с содержанием сульфидной серы 1.2% применение заявленного способа обеспечило прирост извлечения меди на 9.4% и золота на 11.2% относительно базового реагентного режима.",
      "page_range": [2, 3]
    }
  ],
  "tables": [],
  "metadata": {
    "file_name": "Регламент 1.png",
    "file_type": "png",
    "ocr_confidence": 0.86,
    "extra": { "ocr_engine": "mock" }
  }
}
