{
  "doc_id": "921f8a3b-7ab1-464f-9908-848c48454744",
  "source_type": "other",
  "title": "Типичный список оборудования 3",
  "authors": [],
  "date": null,
  "language": "ru",
  "full_text": "Кол. Поз Наименование (gab pes) | Примеч 2PG-12 Агрегат электронасосный om Насос W2-57, W2-58 ПД Зумпф 1 5-Р6-01 Агрегат электронасосный \"Насос ПД Зумпф 1 5-Р- Агрегат электронасосный сущ, \"Насос W5-3 ПД Зумпф 1 5-26-03 Агрегат электронасосный om Насос W5-6 ПД Зумпф 1",
  "sections": [
    {
      "heading": "",
      "text": "Кол. Поз Наименование (gab pes) | Примеч 2PG-12 Агрегат электронасосный om Насос W2-57, W2-58 ПД Зумпф 1 5-Р6-01 Агрегат электронасосный \"Насос ПД Зумпф 1 5-Р- Агрегат электронасосный сущ, \"Насос W5-3 ПД Зумпф 1 5-26-03 Агрегат электронасосный om Насос W5-6 ПД Зумпф 1",
      "page_range": [
        1,
        1
      ]
    }
  ],
  "tables": [],
  "metadata": {
    "file_name": "Типичный список оборудования 3.png",
    "file_type": "png",
    "ocr_confidence": 0.6319,
    "extra": {
      "ocr_engine": "tesseract"
    }
  }
}