{
  "doc_id": "dea60d4e-5e02-470b-a6d1-b092cfc87217",
  "source_type": "other",
  "title": "Схема флотации 3",
  "authors": [],
  "date": null,
  "language": "ru",
  "full_text": "Исходная руда Измельчение [ ст. Измельчение П ст. Грохочение cota — И i — Основная флотация Контрольная флотация На перечистную флотацию На перечистную | флотацию Концентрат Концентрат",
  "sections": [
    {
      "heading": "",
      "text": "Исходная руда Измельчение [ ст. Измельчение П ст. Грохочение cota — И i — Основная флотация Контрольная флотация На перечистную флотацию На перечистную | флотацию Концентрат Концентрат",
      "page_range": [
        1,
        1
      ]
    }
  ],
  "tables": [],
  "metadata": {
    "file_name": "Схема флотации 3.png",
    "file_type": "png",
    "ocr_confidence": 0.8281,
    "extra": {
      "ocr_engine": "tesseract"
    }
  }
}