{
  "doc_id": "4720be0b-d208-44bb-8621-1077def071f9",
  "source_type": "other",
  "title": "Схема 2",
  "authors": [],
  "date": null,
  "language": "ru",
  "full_text": "",
  "sections": [
    {
      "heading": "",
      "text": "",
      "page_range": [
        1,
        1
      ]
    }
  ],
  "tables": [],
  "metadata": {
    "file_name": "Схема 2.png",
    "file_type": "png",
    "ocr_confidence": 0.0,
    "extra": {
      "ocr_engine": "tesseract"
    }
  }
}